{
  "system_profile_id": "isp_alpha_2026",
  "related_intake_id": "intake_alpha_2026",
  "known_systems": [
    { "name": "ERP", "category": "ERP", "role": "system of record for stock, purchasing, and orders", "notes": "on-premise, limited internal reporting flexibility" },
    { "name": "branch reorder spreadsheets", "category": "spreadsheet", "role": "branch-level reorder point tracking", "notes": "one per branch, maintained manually, not integrated with the ERP" }
  ],
  "records_source_of_truth": {
    "system_name": "ERP",
    "confidence": "low",
    "notes": "Nominally the ERP, but staff trust physical counts more, and branches rely on their own spreadsheets for reordering."
  },
  "integrations": [
    {
      "description": "Branch spreadsheets are reconciled to the ERP by manual re-keying",
      "integration_type": "manual",
      "reliability": "low"
    }
  ],
  "manual_workarounds": [
    {
      "description": "Branches maintain separate reorder spreadsheets because they do not trust ERP availability figures",
      "workflow_area": "replenishment",
      "evidence_references": ["evid_alpha_002"]
    }
  ],
  "reporting_outputs": [
    { "name": "stock-on-hand export", "purpose": "purchasing decisions", "source_system": "ERP" },
    { "name": "cycle-count report", "purpose": "count reconciliation", "source_system": "ERP" }
  ],
  "data_quality_concerns": [
    {
      "description": "On-hand balances diverge from physical counts across many SKUs",
      "data_domain": "counts",
      "severity": "high",
      "evidence_references": ["evid_alpha_002"]
    },
    {
      "description": "Negative on-hand balances are not flagged or prevented by the ERP",
      "data_domain": "transactions",
      "severity": "medium",
      "evidence_references": []
    }
  ],
  "access_status": {
    "status": "partial",
    "notes": "ERP read access requested and pending IT approval; branch spreadsheets restricted pending management sign-off."
  },
  "evidence_references": ["evid_alpha_002"],
  "consultant_notes": "Multiple competing sources of truth is a core theme; confirm once ERP export is available."
}
